{
  "schema_version": 2,
  "revision": 0,
  "profile": "examplepack:tagged_metals",
  "rules": [
    {
      "id": "tagged_tin",
      "enabled": true,
      "required": false,
      "terrain_modes": ["flat", "cavern", "wild"],
      "targets": [
        {
          "block_tag": "c:ores/tin",
          "state": {},
          "replace_tag": "minecraft:stone_ore_replaceables"
        }
      ],
      "biomes": {
        "include": ["#delvefold:mining_biomes"],
        "exclude": []
      },
      "bands": [
        {
          "id": "main",
          "vein_size": 7,
          "attempts_per_chunk": 6.0,
          "distribution": "triangle",
          "min_y": -48,
          "max_y": 96,
          "peak_y": 12,
          "plateau_min_y": null,
          "plateau_max_y": null,
          "discard_on_air_exposure": 0.25
        }
      ]
    }
  ]
}
